{
  "name": "Blight",
  "level": 4,
  "school": "Necromancy",
  "casting_time": "Action",
  "range": "30 feet",
  "components": [
    "V",
    "S"
  ],
  "duration": "Instantaneous",
  "description": "A creature that you can see within range makes a Constitution saving throw, taking 8d8 Necrotic damage on a failed save or half as much damage on a successful one. A Plant creature automatically fails the save.\n\nAlternatively, target a nonmagical plant that isn't a creature, such as a tree or shrub. It doesn't make a save; it simply withers and dies.\n\nUsing a Higher-Level Spell Slot. The damage increases by 1d8 for each spell slot level above 4.",
  "classes": [
    "Druid",
    "Sorcerer",
    "Warlock",
    "Wizard"
  ],
  "ritual": false
}
