{
  "name": "Blinding Smite",
  "level": 3,
  "school": "Evocation",
  "casting_time": "Bonus Action, which you take immediately after hitting a creature with a Melee weapon or an Unarmed Strike",
  "range": "Self",
  "components": [
    "V"
  ],
  "duration": "1 minute",
  "description": "The target hit by the strike takes an extra 3d8 Radiant damage from the attack, and the target has the Blinded condition until the spell ends. At the end of each of its turns, the Blinded target makes a Constitution saving throw, ending the spell on itself on a success.\n\nUsing a Higher-Level Spell Slot. The extra damage increases by 1d8 for each spell slot level above 3.",
  "classes": [
    "Paladin"
  ],
  "ritual": false
}
