{
  "name": "Antilife Shell",
  "level": 5,
  "school": "Abjuration",
  "casting_time": "Action",
  "range": "Self",
  "components": [
    "V",
    "S"
  ],
  "duration": "Concentration, up to 1 hour",
  "description": "An aura extends from you in a 10-foot Emanation for the duration. The aura prevents creatures other than Constructs and Undead from passing or reaching through it. An affected creature can cast spells or make attacks with Ranged or Reach weapons through the barrier.\n\nIf you move so that an affected creature is forced to pass through the barrier, the spell ends.",
  "classes": [
    "Druid"
  ],
  "ritual": false
}
