{
  "name": "Detect Magic",
  "level": 1,
  "school": "Divination",
  "casting_time": "Action or Ritual",
  "range": "Self",
  "components": [
    "V",
    "S"
  ],
  "duration": "Concentration, up to 10 minutes",
  "description": "For the duration, you sense the presence of magical effects within 30 feet of yourself. If you sense such effects, you can take the Magic action to see a faint aura around any visible creature or object in the area that bears the magic, and if an effect was created by a spell, you learn the spell's school of magic.\n\nThe spell is blocked by 1 foot of stone, dirt, or wood; 1 inch of metal; or a thin sheet of lead.",
  "classes": [
    "Artificer",
    "Bard",
    "Cleric",
    "Druid",
    "Paladin",
    "Ranger",
    "Sorcerer",
    "Warlock",
    "Wizard"
  ],
  "ritual": true
}
