{
  "name": "Sleep",
  "level": 1,
  "school": "Enchantment",
  "casting_time": "Action",
  "range": "60 feet",
  "components": [
    "V",
    "S",
    "M (a pinch of sand or rose petals)"
  ],
  "duration": "Concentration, up to 1 minute",
  "description": "Each creature of your choice in a 5-foot-radius Sphere centered on a point within range must succeed on a Wisdom saving throw or have the Incapacitated condition until the end of its next turn, at which point it must repeat the save. If the target fails the second save, the target has the Unconscious condition for the duration. The spell ends on a target if it takes damage or someone within 5 feet of it takes an action to shake it out of the spell's effect.\n\nCreatures that don't sleep, such as elves, or that have Immunity to the Exhaustion condition automatically succeed on saves against this spell.",
  "classes": [
    "Bard",
    "Sorcerer",
    "Wizard"
  ],
  "ritual": false,
  "material": "a pinch of sand or rose petals"
}
