{
  "name": "Sanctuary",
  "level": 1,
  "school": "Abjuration",
  "casting_time": "Bonus Action",
  "range": "30 feet",
  "components": [
    "V",
    "S",
    "M (a shard of glass from a mirror)"
  ],
  "duration": "1 minute",
  "description": "You ward a creature within range. Until the spell ends, any creature who targets the warded creature with an attack roll or a damaging spell must succeed on a Wisdom saving throw or either choose a new target or lose the attack or spell. This spell doesn't protect the warded creature from areas of effect.\n\nThe spell ends if the warded creature makes an attack roll, casts a spell, or deals damage.",
  "classes": [
    "Artificer",
    "Cleric"
  ],
  "ritual": false,
  "material": "a shard of glass from a mirror"
}
