{
  "name": "Detect Poison and Disease",
  "level": 1,
  "school": "Divination",
  "casting_time": "Action or Ritual",
  "range": "Self",
  "components": [
    "V",
    "S",
    "M (a yew leaf)"
  ],
  "duration": "Concentration, up to 10 minutes",
  "description": "For the duration, you sense the location of poisons, poisonous or venomous creatures, and magical contagions within 30 feet of yourself. You sense the kind of poison, creature, or contagion in each case.\n\nThe spell is blocked by 1 foot of stone, dirt, or wood; 1 inch of metal; or a thin sheet of lead.",
  "classes": [
    "Cleric",
    "Druid",
    "Paladin",
    "Ranger"
  ],
  "ritual": true,
  "material": "a yew leaf"
}
